{
  "schema_version": "jj-flow/ralph-run/1.0",
  "run_id": "RALPH-example-20260723",
  "title": "Example title",
  "phase": "ANALYZE",
  "status": "IN_PROGRESS",
  "goal": "One-line goal",
  "scope": {
    "in": [],
    "out": []
  },
  "assumptions": [],
  "iteration": 0,
  "max_iterations": 20,
  "intensity": "standard",
  "budget": {
    "max_deliver_loops": 20,
    "max_accept_rechecks": 2,
    "max_same_strategy_failures": 2
  },
  "stagnation": {
    "patience": 2,
    "unchanged_count": 0,
    "last_signal": null,
    "last_score": null,
    "last_fingerprint": null
  },
  "accept_layers": {
    "mechanical": "PENDING",
    "judgment": "SKIPPED",
    "judgment_mode": "none",
    "recheck_count": 0
  },
  "gate_issues": [],
  "plan_options": null,
  "tasks": [],
  "gates": {
    "analyze": "PENDING",
    "plan": "PENDING",
    "deliver": "PENDING",
    "accept": "PENDING",
    "archive": "PENDING"
  },
  "intervention_needed": null,
  "capability_ids": [
    "CAP-example"
  ],
  "artifact_refs": {
    "analyze": "analyze.md",
    "plan": "plan.md",
    "acceptance": "acceptance.md",
    "progress": "progress.md",
    "handoff_ref": null,
    "dispatch_snapshot_ref": null,
    "latest_review_ref": null
  },
  "review": null,
  "handoff": null,
  "dispatch_recommendation": null,
  "created_at": "2026-07-23T00:00:00.000Z",
  "updated_at": "2026-07-23T00:00:00.000Z",
  "family": null,
  "knowledge_refs": [],
  "knowledge_summary": [],
  "host": null
}
