{
  "schema_version": "jj-flow/ralph-run/1.0",
  "run_id": "RALPH-login-reminder-20260722",
  "title": "登录密码更新提醒",
  "phase": "ACCEPT",
  "status": "IN_PROGRESS",
  "goal": "在登录成功后提示用户更新过期密码，不改动注册与找回密码流程。",
  "scope": {
    "in": [
      "登录成功后的密码过期提示",
      "跳转修改密码入口"
    ],
    "out": [
      "注册页",
      "找回密码",
      "后台密码策略配置"
    ]
  },
  "assumptions": [
    "后端已提供 password_expired 字段；前端只做展示与跳转。"
  ],
  "iteration": 2,
  "max_iterations": 20,
  "tasks": [
    {
      "id": "TASK-1",
      "req": "REQ-001",
      "title": "登录响应识别 password_expired",
      "status": "DONE",
      "evidence": [
        "src/api/auth.js",
        "tests/auth-login.test.js"
      ]
    },
    {
      "id": "TASK-2",
      "req": "REQ-002",
      "title": "提示条与修改密码入口",
      "status": "DONE",
      "evidence": [
        "src/views/login/LoginView.vue"
      ]
    }
  ],
  "gates": {
    "analyze": "PASS",
    "plan": "PASS",
    "deliver": "PASS",
    "accept": "PENDING",
    "archive": "PENDING"
  },
  "intervention_needed": null,
  "capability_ids": [
    "CAP-login-reminder"
  ],
  "artifact_refs": {
    "analyze": "analyze.md",
    "plan": "plan.md",
    "acceptance": "acceptance.md",
    "progress": "progress.md",
    "handoff_ref": null,
    "dispatch_snapshot_ref": null
  },
  "handoff": null,
  "dispatch_recommendation": null,
  "created_at": "2026-07-22T08:00:00.000Z",
  "updated_at": "2026-07-22T10:30:00.000Z",
  "family": null,
  "knowledge_refs": [
    "cap-sample-login-reminder"
  ],
  "knowledge_summary": [
    "cap-sample-login-reminder: 登录密码更新提醒"
  ]
}
