{
  "schema_version": "jj-flow/ralph-run/1.0",
  "run_id": "RALPH-example-20260723",
  "title": "示例标题",
  "phase": "ANALYZE",
  "status": "IN_PROGRESS",
  "goal": "一句话目标",
  "scope": {
    "in": [],
    "out": []
  },
  "assumptions": [],
  "iteration": 0,
  "max_iterations": 20,
  "tasks": [],
  "gates": {
    "analyze": "PENDING",
    "plan": "PENDING",
    "deliver": "PENDING",
    "accept": "PENDING",
    "archive": "PENDING"
  },
  "intervention_needed": null,
  "capability_ids": [
    "CAP-example"
  ],
  "artifact_refs": {
    "analyze": "analyze.md",
    "plan": "plan.md",
    "acceptance": "acceptance.md",
    "progress": "progress.md",
    "handoff_ref": null,
    "dispatch_snapshot_ref": null,
    "latest_review_ref": null
  },
  "review": null,
  "handoff": null,
  "dispatch_recommendation": null,
  "created_at": "2026-07-23T00:00:00.000Z",
  "updated_at": "2026-07-23T00:00:00.000Z",
  "family": null,
  "knowledge_refs": [],
  "knowledge_summary": [],
  "host": null
}
